{
  "domain": "cloudflare.com",
  "company_name": "Cloudflare",
  "overall_grounding_confidence": 0.94,
  "confidence_breakdown": {
    "overall_grounding": 0.94,
    "layer_1_whois": 0.98,
    "layer_2_dns_security": 0.98,
    "layer_3_network": 0.98,
    "layer_4_ssl_tls": 0.98,
    "layer_5_headers_cdn": 0.95,
    "layer_6_tech_stack": 0.7,
    "layer_7_marketing": 0.95,
    "layer_8_site_structure": 0.95,
    "layer_9_github_dev": 0.98
  },
  "evidence_provenance": {
    "layer_1_whois": {
      "source": "RDAP",
      "status": "VERIFIED"
    },
    "layer_2_dns_security": {
      "source": "Authoritative DNS (dnspython)",
      "status": "VERIFIED"
    },
    "layer_3_network": {
      "source": "Socket / Shodan InternetDB",
      "status": "VERIFIED"
    },
    "layer_4_ssl_tls": {
      "source": "Native TLS Handshake Context",
      "status": "VERIFIED"
    },
    "layer_5_headers_cdn": {
      "source": "HTTP Response Headers",
      "status": "VERIFIED"
    },
    "layer_6_tech_stack": {
      "source": "DOM & Script Signature Analysis",
      "status": "BASE_ONLY"
    },
    "layer_7_marketing": {
      "source": "HTML Pixel Regex Matcher",
      "status": "VERIFIED"
    },
    "layer_8_site_structure": {
      "source": "BeautifulSoup4 HTML/JSON-LD Parser",
      "status": "VERIFIED"
    },
    "layer_9_github_dev": {
      "source": "GitHub Org REST API",
      "status": "VERIFIED"
    }
  },
  "layer_1_whois_rdap": {
    "domain": "cloudflare.com",
    "registrar": "Cloudflare, Inc.",
    "creation_date": "2009-02-17",
    "name_servers": [
      "ns3.cloudflare.com",
      "ns4.cloudflare.com",
      "ns5.cloudflare.com",
      "ns6.cloudflare.com"
    ],
    "registrant_org": "Privacy Protected",
    "query_source": "RDAP"
  },
  "layer_2_dns_security": {
    "domain": "cloudflare.com",
    "mx_records": [
      "mxa.global.inbound.cf-emailsecurity.net",
      "mxb.global.inbound.cf-emailsecurity.net",
      "mxa-canary.global.inbound.cf-emailsecurity.net",
      "mxb-canary.global.inbound.cf-emailsecurity.net"
    ],
    "email_provider": "Custom / Self-Hosted Mail Server",
    "spf": {
      "status": "valid",
      "record": "v=spf1 ip4:199.15.212.0/22 ip4:173.245.48.0/20 include:_spf.google.com include:spf1.mcsv.net include:spf.mandrillapp.com include:mail.zendesk.com include:stspg-customer.com include:_spf.salesforce.com -all",
      "lookup_count": 6,
      "has_all_qualifier": true
    },
    "dmarc": {
      "status": "configured",
      "policy": "reject",
      "record": "v=DMARC1; p=reject; sp=reject; adkim=r; aspf=r; pct=100; rua=mailto:a1c47f179bc04efd8ee4dcd4d85dfc65@dmarc-reports.cloudflare.net,mailto:rua@cloudflare.com"
    },
    "dkim_selectors_found": [
      "k1",
      "s1",
      "mandrill"
    ],
    "has_ipv6": true,
    "caa_records": [
      "0 issue \"ssl.com\"",
      "0 issuewild \"comodoca.com\"",
      "0 issuewild \"digicert.com; cansignhttpexchanges=yes\"",
      "0 issuewild \"letsencrypt.org\"",
      "0 issuewild \"pki.goog; cansignhttpexchanges=yes\"",
      "0 issuewild \"ssl.com\"",
      "0 iodef \"mailto:tls-abuse@cloudflare.com\"",
      "0 issue \"comodoca.com\"",
      "0 issue \"digicert.com; cansignhttpexchanges=yes\"",
      "0 issue \"letsencrypt.org\"",
      "0 issue \"pki.goog; cansignhttpexchanges=yes\""
    ]
  },
  "layer_3_network_infra": {
    "domain": "cloudflare.com",
    "ip_addresses": [
      "104.16.132.229",
      "104.16.133.229"
    ],
    "reverse_dns": [],
    "open_ports": [
      80,
      443,
      2082,
      2083,
      2086,
      2087,
      2095,
      8080,
      8443,
      8880
    ],
    "cpes": [
      "cpe:/a:cloudflare:cloudflare"
    ],
    "vulns": [],
    "hostnames": [
      "cloudflare.com",
      "secondary.cloudflare.com",
      "ns.cloudflare.com"
    ],
    "tags": [
      "cdn"
    ],
    "shodan_accessible": true
  },
  "layer_4_ssl_cert": {
    "domain": "cloudflare.com",
    "ssl_active": true,
    "tls_version": "TLSv1.3",
    "cipher_suite": "TLS_AES_256_GCM_SHA384",
    "issuer_org": "Google Trust Services",
    "issuer_common_name": "WE1",
    "valid_from": "Jul  8 21:47:39 2026 GMT",
    "valid_until": "Oct  6 22:47:27 2026 GMT",
    "subject_alt_names": [
      "cloudflare.com",
      "ns.cloudflare.com",
      "*.ns.cloudflare.com",
      "*.secondary.cloudflare.com",
      "secondary.cloudflare.com"
    ]
  },
  "layer_5_headers_fingerprint": {
    "domain": "cloudflare.com",
    "status_code": 200,
    "server_banner": "cloudflare",
    "detected_cdn": [
      "Cloudflare"
    ],
    "hosting_platform": "Unknown",
    "framework_header": null,
    "security_headers": {
      "strict_transport_security": true,
      "content_security_policy": true,
      "x_frame_options": true,
      "x_content_type_options": true,
      "referrer_policy": true,
      "permissions_policy": true
    },
    "security_posture_score": 100,
    "raw_interesting_headers": {
      "server": "cloudflare",
      "cf-ray": "a2ea484be9e01764-MRS"
    }
  },
  "layer_6_tech_stack": {
    "domain": "cloudflare.com",
    "cms": "Custom / Headless",
    "frontend_frameworks": [],
    "ui_libraries": [],
    "backend_signals": [
      "Generator: Astro v6.3.7"
    ],
    "ecommerce": null
  },
  "layer_7_marketing_pixels": {
    "runs_paid_ads": false,
    "detected_pixels": [],
    "marketing_stack": [
      "Google Tag Manager",
      "HubSpot Marketing"
    ],
    "tag_manager_present": true
  },
  "layer_8_site_structure": {
    "domain": "cloudflare.com",
    "page_title": "Cloudflare: Build for the agent era",
    "meta_description": "Welcome to Cloudflare - Powering the next generation of applications",
    "og_title": "Cloudflare: Build for the agent era",
    "og_description": "Welcome to Cloudflare - Powering the next generation of applications",
    "og_image": "https://www.cloudflare.com/preview.png",
    "json_ld_types": [
      "Organization",
      "WebPage",
      "WebSite"
    ],
    "core_headings": [
      "Everything we learned from powering 20% of the Internet—yours by default",
      "Region: Earth",
      "Cloudflare powers 45% of the Fortune 500",
      "Why choose Cloudflare",
      "Pay onlywhenyourcoderuns",
      "Build without boundaries"
    ],
    "has_robots_txt": true,
    "has_sitemap_xml": true,
    "canonical_url": "https://www.cloudflare.com/"
  },
  "layer_9_github_signals": {
    "org_name": "cloudflare",
    "public_repos": 574,
    "top_languages": [
      "TypeScript",
      "Go",
      "JavaScript",
      "Rust",
      "Python"
    ]
  },
  "layer_10_signal_grounded_angles": [
    {
      "pillar": "Infrastructure Integration & Mail Flow",
      "factual_trigger": "Domain operates on Custom / Self-Hosted Mail Server with strict DMARC REJECT policy (k1, s1 selectors).",
      "angle_thesis": "Hardened mail security postures require zero-friction DKIM/SPF alignment when integrating external workflow automation.",
      "sample_hook": "Noticed Cloudflare maintains a hardened Custom / Self-Hosted Mail Server setup with strict DMARC REJECT enforcement. When connecting external data or enrichment tooling into your workflow, how do you handle DKIM selector alignment without compromising sender reputation?"
    },
    {
      "pillar": "Analytics Stack & Data Pipeline Enrichment",
      "factual_trigger": "Marketing and analytics event routing detected: Google Tag Manager, HubSpot Marketing.",
      "angle_thesis": "Modern customer data pipelines benefit from passing raw technographic signals directly into event streams rather than relying on static form fills.",
      "sample_hook": "Noticed Cloudflare's web setup routes events through Google Tag Manager, HubSpot Marketing. Are you currently enriching incoming lead events with live technographic/DNS signals at the data layer, or relying mostly on form inputs?"
    },
    {
      "pillar": "Developer Velocity & Technical Stack",
      "factual_trigger": "Active public GitHub organization with 574 public repositories (primary languages: TypeScript, Go).",
      "angle_thesis": "High public engineering velocity indicates a developer-first culture that values structured JSON schemas and API-first tooling.",
      "sample_hook": "Noticed Cloudflare's GitHub org has 574 public repos with heavy TypeScript, Go activity. Is your engineering team maintaining custom internal scrapers for account intelligence, or leveraging structured schema-validated APIs?"
    }
  ]
}